{
    "$schema": "https://json-schema.org/draft/2020-12/schema",
    "title": "Transmission Response",
    "description": "",
    "$id": "transmission-response",
    "type": "object",
    "properties": {
        "version": {
            "$ref": "version.json"
        },
        "receiver": {
            "$ref": "transmission-receiver.json"
        },
        "transaction_ids": {
            "type": "array",
            "items": {
                "description": "The transaction-ids of the Addressable Contents for which the Receiver want to participate to",
                "$ref": "transaction_id.json"
            }
        },
        "status": {
            "$ref": "transmission-status.json"
        },
        "details": {
            "$ref": "transmission-details.json"
        },
        "source": {
            "description": "Signature based on input:\n```\ntransmission_response.receiver                + '\\u2063' +\ntransmission_response.status                  + '\\u2063'\ntransmission_response.source.domain           + '\\u2063' +\ntransmission_response.source.timestamp        + '\\u2063' +\nseed.source.signature+ '\\u2063' +\ntransaction_ids[0] + '\\u2063' +\n... + '\\u2063' +\ntransaction_ids[n]\n```",
            "$ref": "source.json"
        },
        "children": {
            "type": "array",
            "items": {
                "$ref": "transmission-result.json"
            }
        }
    },
    "required": [
        "version",
        "receiver",
        "transaction_ids",
        "status",
        "details",
        "source",
        "children"
    ]
}